{
  "schema_version": "0.2.0",
  "dataset_id": "synthetic-context-lifecycle",
  "evidence": {
    "schema_version": "0.1.0",
    "dataset_id": "synthetic-context-lifecycle",
    "sources": [
      {
        "id": "synthetic-transcript",
        "harness": "fixture",
        "format": "synthetic",
        "coverage": "complete",
        "description": "Synthetic demonstration; token weights and monetary amounts are illustrative."
      }
    ],
    "relationships": [
      {
        "from": "request-1",
        "to": "request-2",
        "kind": "context_from"
      },
      {
        "from": "request-2",
        "to": "request-3",
        "kind": "context_from"
      }
    ],
    "issues": [
      {
        "code": "SYNTHETIC_FIXTURE",
        "severity": "info",
        "message": "Illustrative token weights, outcomes and cost values; no provider call was made."
      }
    ],
    "observations": [
      {
        "id": "request-1",
        "kind": "model",
        "operation": "Inspect allocation",
        "status": "ok",
        "accounting_scope": "direct",
        "timestamp": "2026-09-06T10:00:00Z",
        "agent_id": "fixture-coder",
        "model": "fixture-model",
        "model_identity": "setting",
        "source_refs": [
          {
            "source_id": "synthetic-transcript",
            "record": "request-1"
          }
        ],
        "usage": {
          "input_tokens": "400",
          "output_tokens": "50",
          "cache_read_input_tokens": null,
          "cache_write_input_tokens": null,
          "reasoning_output_tokens": null
        },
        "recorded_cost": {
          "amount": "0.0025",
          "currency": "USD",
          "basis": "model_price_estimate"
        }
      },
      {
        "id": "request-2",
        "kind": "model",
        "operation": "Implement and test",
        "status": "ok",
        "accounting_scope": "direct",
        "timestamp": "2026-09-06T10:01:00Z",
        "agent_id": "fixture-coder",
        "model": "fixture-model",
        "model_identity": "setting",
        "source_refs": [
          {
            "source_id": "synthetic-transcript",
            "record": "request-2"
          }
        ],
        "usage": {
          "input_tokens": "650",
          "output_tokens": "50",
          "cache_read_input_tokens": null,
          "cache_write_input_tokens": null,
          "reasoning_output_tokens": null
        },
        "recorded_cost": {
          "amount": "0.0045",
          "currency": "USD",
          "basis": "model_price_estimate"
        }
      },
      {
        "id": "request-3",
        "kind": "model",
        "operation": "Explain coverage",
        "status": "ok",
        "accounting_scope": "direct",
        "timestamp": "2026-09-06T10:02:00Z",
        "agent_id": "fixture-coder",
        "model": "fixture-model",
        "model_identity": "setting",
        "source_refs": [
          {
            "source_id": "synthetic-transcript",
            "record": "request-3"
          }
        ],
        "usage": {
          "input_tokens": "220",
          "output_tokens": "50",
          "cache_read_input_tokens": null,
          "cache_write_input_tokens": null,
          "reasoning_output_tokens": null
        },
        "recorded_cost": {
          "amount": "0.0018",
          "currency": "USD",
          "basis": "model_price_estimate"
        }
      }
    ]
  },
  "valuation": {
    "schema_version": "0.1.0",
    "id": "val-03d23a5980cd43630bc724163b23dfa60b97036815c86aea48c31ce9b9495675",
    "dataset_id": "synthetic-context-lifecycle",
    "selection_policy": "direct-only-v1",
    "currency": "USD",
    "basis": "model_price_estimate",
    "assumptions": [
      "selection policy: direct-only-v1",
      "recorded monetary amounts are rounded once to nano-currency using HALF_EVEN"
    ],
    "observations": [
      {
        "observation_id": "request-1",
        "amount_nanos": "2500000",
        "basis": "model_price_estimate"
      },
      {
        "observation_id": "request-2",
        "amount_nanos": "4500000",
        "basis": "model_price_estimate"
      },
      {
        "observation_id": "request-3",
        "amount_nanos": "1800000",
        "basis": "model_price_estimate"
      }
    ],
    "total_nanos": "8800000",
    "complete": true,
    "issues": [
      {
        "code": "SYNTHETIC_FIXTURE",
        "severity": "info",
        "message": "Illustrative token weights, outcomes and cost values; no provider call was made."
      }
    ]
  },
  "context": {
    "artifacts": [
      {
        "coverage": "complete",
        "description": "Synthetic demonstration; token weights and monetary amounts are illustrative.",
        "format": "synthetic",
        "harness": "fixture",
        "id": "synthetic-transcript"
      }
    ],
    "dataset_id": "synthetic-context-lifecycle",
    "evidence_schema_version": "0.1.0",
    "issues": [],
    "profiles": [
      {
        "artifacts": [],
        "context_capabilities": [
          {
            "capture": "unknown",
            "evidence": "unknown",
            "note": "No capture capability has been established for this profile.",
            "origin": "system_instruction",
            "source_refs": []
          },
          {
            "capture": "unknown",
            "evidence": "unknown",
            "note": "No capture capability has been established for this profile.",
            "origin": "developer_instruction",
            "source_refs": []
          },
          {
            "capture": "unknown",
            "evidence": "unknown",
            "note": "No capture capability has been established for this profile.",
            "origin": "user_prompt",
            "source_refs": []
          },
          {
            "capture": "unknown",
            "evidence": "unknown",
            "note": "No capture capability has been established for this profile.",
            "origin": "repository_instruction",
            "source_refs": []
          },
          {
            "capture": "unknown",
            "evidence": "unknown",
            "note": "No capture capability has been established for this profile.",
            "origin": "skill",
            "source_refs": []
          },
          {
            "capture": "unknown",
            "evidence": "unknown",
            "note": "No capture capability has been established for this profile.",
            "origin": "repository_file",
            "source_refs": []
          },
          {
            "capture": "unknown",
            "evidence": "unknown",
            "note": "No capture capability has been established for this profile.",
            "origin": "retrieved_document",
            "source_refs": []
          },
          {
            "capture": "unknown",
            "evidence": "unknown",
            "note": "No capture capability has been established for this profile.",
            "origin": "tool_result",
            "source_refs": []
          },
          {
            "capture": "unknown",
            "evidence": "unknown",
            "note": "No capture capability has been established for this profile.",
            "origin": "tool_schema",
            "source_refs": []
          },
          {
            "capture": "unknown",
            "evidence": "unknown",
            "note": "No capture capability has been established for this profile.",
            "origin": "output_schema",
            "source_refs": []
          },
          {
            "capture": "unknown",
            "evidence": "unknown",
            "note": "No capture capability has been established for this profile.",
            "origin": "conversation_history",
            "source_refs": []
          },
          {
            "capture": "unknown",
            "evidence": "unknown",
            "note": "No capture capability has been established for this profile.",
            "origin": "assistant_output",
            "source_refs": []
          },
          {
            "capture": "unknown",
            "evidence": "unknown",
            "note": "No capture capability has been established for this profile.",
            "origin": "memory",
            "source_refs": []
          },
          {
            "capture": "unknown",
            "evidence": "unknown",
            "note": "No capture capability has been established for this profile.",
            "origin": "delegated_context",
            "source_refs": []
          },
          {
            "capture": "unknown",
            "evidence": "unknown",
            "note": "No capture capability has been established for this profile.",
            "origin": "attachment",
            "source_refs": []
          },
          {
            "capture": "unknown",
            "evidence": "unknown",
            "note": "No capture capability has been established for this profile.",
            "origin": "unknown",
            "source_refs": []
          }
        ],
        "harness": "fixture",
        "harness_version": {
          "evidence": "declared",
          "source_refs": [],
          "value": "1"
        },
        "id": "harness-profile:bb700f4fc28ea3c51bcd6a6e97272c9a275f2bf145c3c7b4e6a5ad671c98ec7f",
        "instruction_sources": [
          {
            "delivery": "always",
            "evidence": "declared",
            "label": "AGENTS.md (illustrative)",
            "origin": "repository_instruction",
            "source_refs": []
          },
          {
            "delivery": "conditional",
            "evidence": "declared",
            "label": "TDD instructions (illustrative)",
            "origin": "skill",
            "source_refs": []
          }
        ],
        "model": {
          "name": {
            "evidence": "declared",
            "source_refs": [],
            "value": "fixture-model"
          },
          "provider": {
            "evidence": "declared",
            "source_refs": [],